{
  "schemaVersion": "2.0",
  "glyph": {
    "char": "a",
    "case": "lower",
    "style": "cursive",
    "name": "traced lower a"
  },
  "guides": {
    "xHeight": 250.1179739932884,
    "baseline": 724.661807885906,
    "leftSidebearing": 310.0204779782059,
    "rightSidebearing": 744.3015594475911
  },
  "strokes": [
    {
      "kind": "stroke",
      "phase": "main",
      "segment": "entry",
      "curves": [
        {
          "p0": {
            "x": 388.9002079586331,
            "y": 292.568289118705
          },
          "p1": {
            "x": 443.4717850719424,
            "y": 289.3751405125899
          },
          "p2": {
            "x": 458.9666290857191,
            "y": 276.6640691923203
          },
          "p3": {
            "x": 527.3390403032033,
            "y": 259.25215599529685
          },
          "segment": "entry"
        },
        {
          "p0": {
            "x": 527.3390403032033,
            "y": 259.25215599529685
          },
          "p1": {
            "x": 662.608799920691,
            "y": 264.23227267721495
          },
          "p2": {
            "x": 685.1297637976729,
            "y": 279.8106902733174
          },
          "p3": {
            "x": 734.5429133784174,
            "y": 335.09482476689686
          },
          "segment": "entry"
        }
      ]
    },
    {
      "kind": "stroke",
      "phase": "main",
      "segment": "body",
      "curves": [
        {
          "p0": {
            "x": 734.5429133784174,
            "y": 335.09482476689686
          },
          "p1": {
            "x": 736.2172274871776,
            "y": 336.756449173457
          },
          "p2": {
            "x": 737.891541595938,
            "y": 338.4180735800171
          },
          "p3": {
            "x": 739.5658557046982,
            "y": 340.07969798657723
          },
          "segment": "body"
        }
      ]
    },
    {
      "kind": "stroke",
      "phase": "main",
      "segment": "body",
      "curves": [
        {
          "p0": {
            "x": 731.4206213671537,
            "y": 332.69239096817506
          },
          "p1": {
            "x": 620.0424554485483,
            "y": 211.74558905824384
          },
          "p2": {
            "x": 453.83297089590445,
            "y": 260.7246931444922
          },
          "p3": {
            "x": 391.4080787533706,
            "y": 326.8776387353546
          },
          "segment": "body"
        },
        {
          "p0": {
            "x": 391.4080787533706,
            "y": 326.8776387353546
          },
          "p1": {
            "x": 328.98318661083675,
            "y": 393.03058432621697
          },
          "p2": {
            "x": 300.76714151721666,
            "y": 432.25735614626535
          },
          "p3": {
            "x": 313.5972726299549,
            "y": 543.9628944378366
          },
          "segment": "body"
        },
        {
          "p0": {
            "x": 313.5972726299549,
            "y": 543.9628944378366
          },
          "p1": {
            "x": 341.039570781469,
            "y": 730.3701829581796
          },
          "p2": {
            "x": 601.2983618412201,
            "y": 797.1413093989856
          },
          "p3": {
            "x": 713.5987119710649,
            "y": 588.0930502900693
          },
          "segment": "body"
        }
      ]
    },
    {
      "kind": "stroke",
      "phase": "main",
      "segment": "ascender",
      "curves": [
        {
          "p0": {
            "x": 713.5987119710649,
            "y": 588.0930502900693
          },
          "p1": {
            "x": 721.6952234363893,
            "y": 469.48986237060626
          },
          "p2": {
            "x": 730.2410118982064,
            "y": 368.72512999791024
          },
          "p3": {
            "x": 738.3375233635307,
            "y": 250.12194207844695
          },
          "segment": "ascender"
        },
        {
          "p0": {
            "x": 738.3375233635307,
            "y": 250.12194207844695
          },
          "p1": {
            "x": 736.6338640229734,
            "y": 396.0258501036434
          },
          "p2": {
            "x": 705.0288165782316,
            "y": 592.9575619585557
          },
          "p3": {
            "x": 720.1427996692762,
            "y": 669.9080852864678
          },
          "segment": "descender"
        },
        {
          "p0": {
            "x": 720.1427996692762,
            "y": 669.9080852864678
          },
          "p1": {
            "x": 723.897278486955,
            "y": 682.6499437035766
          },
          "p2": {
            "x": 744.4040861061151,
            "y": 718.5181542266187
          },
          "p3": {
            "x": 780.0275404676258,
            "y": 718.2090265287769
          },
          "segment": "exit"
        },
        {
          "p0": {
            "x": 780.0275404676258,
            "y": 718.2090265287769
          },
          "p1": {
            "x": 815.6509948291366,
            "y": 717.8998988309352
          },
          "p2": {
            "x": 873.1231264788322,
            "y": 719.5413979543966
          },
          "p3": {
            "x": 949.6546495014907,
            "y": 663.8651951857968
          },
          "segment": "lead-out"
        }
      ]
    }
  ]
}