{
  "schemaVersion": "2.0",
  "glyph": {
    "char": "G",
    "case": "upper",
    "style": "print",
    "name": "template upper G"
  },
  "guides": {
    "xHeight": 414.62615352348985,
    "baseline": 913.0531669463087,
    "leftSidebearing": 361.60504721223015,
    "rightSidebearing": 1108.5495166366907,
    "descender": 951.8797189597315,
    "ascender": 40.792785234899156
  },
  "strokes": [
    {
      "kind": "stroke",
      "phase": "main",
      "segment": "body",
      "curves": [
        {
          "p0": {
            "x": 990.6188736510792,
            "y": 152.53645763808873
          },
          "p1": {
            "x": 783.9529563848921,
            "y": -67.19713049140766
          },
          "p2": {
            "x": 368.7105440647483,
            "y": 47.02840505915583
          },
          "p3": {
            "x": 370.75500224820144,
            "y": 480.2568223253428
          },
          "segment": "body"
        },
        {
          "p0": {
            "x": 370.75500224820144,
            "y": 480.2568223253428
          },
          "p1": {
            "x": 372.6767929406474,
            "y": 887.4915345555585
          },
          "p2": {
            "x": 816.3832621402878,
            "y": 1190.524036325139
          },
          "p3": {
            "x": 1006.1806429856115,
            "y": 444.14926114528294
          },
          "segment": "body"
        },
        {
          "p0": {
            "x": 1006.1806429856115,
            "y": 444.14926114528294
          },
          "p1": {
            "x": 1008.2461780575538,
            "y": 485.9728335373693
          },
          "p2": {
            "x": 1004.5436713129495,
            "y": 854.1368960373693
          },
          "p3": {
            "x": 1005.2883880395682,
            "y": 908.3888070085923
          },
          "segment": "body"
        }
      ]
    },
    {
      "kind": "stroke",
      "phase": "main",
      "segment": "body",
      "curves": [
        {
          "p0": {
            "x": 911.7561825539567,
            "y": 446.71361591147
          },
          "p1": {
            "x": 973.4224745203836,
            "y": 446.9314104258585
          },
          "p2": {
            "x": 1047.165823591127,
            "y": 444.59890143305273
          },
          "p3": {
            "x": 1108.8321155575538,
            "y": 444.8166959474412
          },
          "segment": "body"
        }
      ]
    }
  ]
}
