{
  "schemaVersion": "2.0",
  "glyph": {
    "char": "L",
    "case": "upper",
    "style": "print",
    "name": "template upper L"
  },
  "guides": {
    "xHeight": 414.62615352348985,
    "baseline": 913.0531669463087,
    "leftSidebearing": 524.3553048050047,
    "rightSidebearing": 967.498070581632,
    "ascender": 40.792785234899156
  },
  "strokes": [
    {
      "kind": "stroke",
      "phase": "main",
      "segment": "body",
      "curves": [
        {
          "p0": {
            "x": 525.6217989195258,
            "y": 40.70195748263524
          },
          "p1": {
            "x": 524.7733810425876,
            "y": 283.6281835403073
          },
          "p2": {
            "x": 524.8938819897566,
            "y": 907.9404335929278
          },
          "p3": {
            "x": 524.5606188170912,
            "y": 907.5808601697888
          },
          "segment": "body"
        },
        {
          "p0": {
            "x": 524.5606188170912,
            "y": 907.5808601697888
          },
          "p1": {
            "x": 524.2273556444258,
            "y": 907.2212867466499
          },
          "p2": {
            "x": 966.71314810917,
            "y": 904.9366799971937
          },
          "p3": {
            "x": 968.1689819687083,
            "y": 909.071774363292
          },
          "segment": "body"
        }
      ]
    }
  ]
}
