{
  "schemaVersion": "2.0",
  "glyph": {
    "char": "F",
    "case": "upper",
    "style": "print",
    "name": "template upper F"
  },
  "guides": {
    "xHeight": 414.62615352348985,
    "baseline": 913.0531669463087,
    "leftSidebearing": 410.98845188871337,
    "rightSidebearing": 806.7658713361341,
    "ascender": 40.792785234899156
  },
  "strokes": [
    {
      "kind": "stroke",
      "phase": "main",
      "segment": "body",
      "curves": [
        {
          "p0": {
            "x": 411.4032992356115,
            "y": 40.33062612410072
          },
          "p1": {
            "x": 409.55438773980813,
            "y": 278.4046200539568
          },
          "p2": {
            "x": 413.4566135177795,
            "y": 672.3071671081103
          },
          "p3": {
            "x": 411.60770202197614,
            "y": 910.3811610379664
          },
          "segment": "body"
        }
      ]
    },
    {
      "kind": "stroke",
      "phase": "main",
      "segment": "body",
      "curves": [
        {
          "p0": {
            "x": 410.07357458780996,
            "y": 41.17983746271338
          },
          "p1": {
            "x": 510.55194208912184,
            "y": 41.557842675730484
          },
          "p2": {
            "x": 704.6435065326644,
            "y": 40.788439414483946
          },
          "p3": {
            "x": 805.1218740339759,
            "y": 41.16644462750105
          },
          "segment": "body"
        }
      ]
    },
    {
      "kind": "stroke",
      "phase": "main",
      "segment": "body",
      "curves": [
        {
          "p0": {
            "x": 416.10574318865224,
            "y": 414.613780508796
          },
          "p1": {
            "x": 520.957516457537,
            "y": 413.4545645222103
          },
          "p2": {
            "x": 658.0530931212062,
            "y": 415.4638687975401
          },
          "p3": {
            "x": 762.904866390091,
            "y": 414.3046528109544
          },
          "segment": "body"
        }
      ]
    }
  ]
}
