{
  "schemaVersion": "2.0",
  "glyph": {
    "char": "Y",
    "case": "upper",
    "style": "print",
    "name": "template upper Y"
  },
  "guides": {
    "xHeight": 414.62615352348985,
    "baseline": 913.0531669463087,
    "leftSidebearing": 375.1027339925533,
    "rightSidebearing": 877.2485720291256,
    "descender": 950.4771392617447,
    "ascender": 40.792785234899156
  },
  "strokes": [
    {
      "kind": "stroke",
      "phase": "main",
      "segment": "body",
      "curves": [
        {
          "p0": {
            "x": 373.40144073619183,
            "y": 39.99775165976346
          },
          "p1": {
            "x": 459.7990375922013,
            "y": 180.83436459048414
          },
          "p2": {
            "x": 572.3890979011637,
            "y": 317.09376223801996
          },
          "p3": {
            "x": 658.7866947571732,
            "y": 457.9303751687407
          },
          "segment": "body"
        }
      ]
    },
    {
      "kind": "stroke",
      "phase": "main",
      "segment": "body",
      "curves": [
        {
          "p0": {
            "x": 881.9447650546637,
            "y": 36.391432349377325
          },
          "p1": {
            "x": 730.8779921139912,
            "y": 327.38805523176796
          },
          "p2": {
            "x": 579.8112191733189,
            "y": 618.3846781141585
          },
          "p3": {
            "x": 428.74444623264657,
            "y": 909.3813009965492
          },
          "segment": "body"
        }
      ]
    }
  ]
}
