{
  "schemaVersion": "2.0",
  "glyph": {
    "char": "Q",
    "case": "upper",
    "style": "print",
    "name": "template upper Q"
  },
  "guides": {
    "xHeight": 414.62615352348985,
    "baseline": 913.0531669463087,
    "leftSidebearing": 220.10829266584176,
    "rightSidebearing": 912.9152779103183,
    "descender": 1000,
    "ascender": 40.792785234899156
  },
  "strokes": [
    {
      "kind": "stroke",
      "phase": "main",
      "segment": "body",
      "curves": [
        {
          "p0": {
            "x": 605.7497751798561,
            "y": 47.10333295863309
          },
          "p1": {
            "x": 343.4354438348639,
            "y": 44.81260378926777
          },
          "p2": {
            "x": 236.70750899280574,
            "y": 248.45084869604318
          },
          "p3": {
            "x": 229.2884442446043,
            "y": 425.9428394784172
          },
          "segment": "body"
        },
        {
          "p0": {
            "x": 229.2884442446043,
            "y": 425.9428394784172
          },
          "p1": {
            "x": 221.86937949640287,
            "y": 603.4348302607912
          },
          "p2": {
            "x": 337.12131857014384,
            "y": 905.3858475719423
          },
          "p3": {
            "x": 552.1547605665468,
            "y": 912.4571436600719
          },
          "segment": "body"
        },
        {
          "p0": {
            "x": 552.1547605665468,
            "y": 912.4571436600719
          },
          "p1": {
            "x": 767.1882025629498,
            "y": 919.5284397482014
          },
          "p2": {
            "x": 907.6481002697841,
            "y": 774.1962679856115
          },
          "p3": {
            "x": 910.1984037769784,
            "y": 483.7181036420863
          },
          "segment": "body"
        },
        {
          "p0": {
            "x": 910.1984037769784,
            "y": 483.7181036420863
          },
          "p1": {
            "x": 912.7487072841726,
            "y": 193.23993929856115
          },
          "p2": {
            "x": 771.2491752200847,
            "y": 46.94110251502167
          },
          "p3": {
            "x": 605.7497751798561,
            "y": 47.10333295863309
          },
          "segment": "body"
        }
      ]
    },
    {
      "kind": "stroke",
      "phase": "main",
      "segment": "body",
      "curves": [
        {
          "p0": {
            "x": 571.496178057554,
            "y": 746.2842937442039
          },
          "p1": {
            "x": 648.3797727443045,
            "y": 856.029251684102
          },
          "p2": {
            "x": 725.2633674310551,
            "y": 965.7742096239999
          },
          "p3": {
            "x": 802.1469621178057,
            "y": 1075.519167563898
          },
          "segment": "body"
        }
      ]
    }
  ]
}
