{
  "schemaVersion": "2.0",
  "glyph": {
    "char": "s",
    "case": "lower",
    "style": "print",
    "name": "traced lower s"
  },
  "guides": {
    "xHeight": 220.1001468120803,
    "baseline": 771.0386954697985,
    "leftSidebearing": 371.05454284899076,
    "rightSidebearing": 783.9991487862543
  },
  "strokes": [
    {
      "kind": "stroke",
      "phase": "main",
      "segment": "body",
      "curves": [
        {
          "p0": {
            "x": 783.5046140939598,
            "y": 301.26625419463085
          },
          "p1": {
            "x": 746.5714928057554,
            "y": 247.88528552158272
          },
          "p2": {
            "x": 729.8292589014018,
            "y": 229.03110976855552
          },
          "p3": {
            "x": 654.0615164118705,
            "y": 225.22060476618705
          },
          "segment": "body"
        },
        {
          "p0": {
            "x": 654.0615164118705,
            "y": 225.22060476618705
          },
          "p1": {
            "x": 574.9793942720183,
            "y": 221.243413258159
          },
          "p2": {
            "x": 489.2578125,
            "y": 232.9874381744604
          },
          "p3": {
            "x": 459.8336497703992,
            "y": 315.91365683504057
          },
          "segment": "body"
        },
        {
          "p0": {
            "x": 459.8336497703992,
            "y": 315.91365683504057
          },
          "p1": {
            "x": 449.08277564555976,
            "y": 348.3480843470771
          },
          "p2": {
            "x": 437.488177573195,
            "y": 389.56289744197164
          },
          "p3": {
            "x": 460.9964869966443,
            "y": 421.5681641314905
          },
          "segment": "body"
        },
        {
          "p0": {
            "x": 460.9964869966443,
            "y": 421.5681641314905
          },
          "p1": {
            "x": 518.1543806822563,
            "y": 499.3854838658656
          },
          "p2": {
            "x": 743.6988637582119,
            "y": 455.54120089960725
          },
          "p3": {
            "x": 771.5511184802158,
            "y": 570.0736285971223
          },
          "segment": "body"
        },
        {
          "p0": {
            "x": 771.5511184802158,
            "y": 570.0736285971223
          },
          "p1": {
            "x": 825.054799910072,
            "y": 806.2717794514388
          },
          "p2": {
            "x": 502.5965127489775,
            "y": 784.7969627759327
          },
          "p3": {
            "x": 372.9133880395683,
            "y": 720.5380227068345
          },
          "segment": "body"
        }
      ]
    }
  ]
}
