{
  "schemaVersion": "2.0",
  "glyph": {
    "char": "I",
    "case": "upper",
    "style": "print",
    "name": "template upper I"
  },
  "guides": {
    "xHeight": 414.62615352348985,
    "baseline": 913.0531669463087,
    "leftSidebearing": 512.3320254855349,
    "rightSidebearing": 743.6784184126143,
    "ascender": 40.792785234899156
  },
  "strokes": [
    {
      "kind": "stroke",
      "phase": "main",
      "segment": "body",
      "curves": [
        {
          "p0": {
            "x": 624.2545429032484,
            "y": 41.991159755840876
          },
          "p1": {
            "x": 626.2614303421502,
            "y": 331.36883463130573
          },
          "p2": {
            "x": 628.2683177810519,
            "y": 620.7465095067705
          },
          "p3": {
            "x": 630.2752052199537,
            "y": 910.1241843822353
          },
          "segment": "body"
        }
      ]
    },
    {
      "kind": "stroke",
      "phase": "main",
      "segment": "body",
      "curves": [
        {
          "p0": {
            "x": 512.7911667719077,
            "y": 38.68922332140602
          },
          "p1": {
            "x": 589.6375616829206,
            "y": 39.482915877359154
          },
          "p2": {
            "x": 666.4839565939334,
            "y": 40.27660843331228
          },
          "p3": {
            "x": 743.3303515049463,
            "y": 41.07030098926542
          },
          "segment": "body"
        }
      ]
    },
    {
      "kind": "stroke",
      "phase": "main",
      "segment": "body",
      "curves": [
        {
          "p0": {
            "x": 511.62913070932433,
            "y": 911.5712481582825
          },
          "p1": {
            "x": 590.4371009612012,
            "y": 911.5829416029375
          },
          "p2": {
            "x": 669.245071213078,
            "y": 911.5946350475923
          },
          "p3": {
            "x": 748.0530414649547,
            "y": 911.6063284922473
          },
          "segment": "body"
        }
      ]
    }
  ]
}