{
  "schemaVersion": "2.0",
  "glyph": {
    "char": "w",
    "case": "lower",
    "style": "print",
    "name": "traced lower w"
  },
  "guides": {
    "xHeight": 281.459731543624,
    "baseline": 704.0687919463087,
    "leftSidebearing": 303.59996057037483,
    "rightSidebearing": 891.9429762354663
  },
  "strokes": [
    {
      "kind": "stroke",
      "phase": "main",
      "segment": "body",
      "curves": [
        {
          "p0": {
            "x": 309.97011325503354,
            "y": 282.94096057046977
          },
          "p1": {
            "x": 345.665438863255,
            "y": 415.993013317953
          },
          "p2": {
            "x": 426.3978904439368,
            "y": 566.2650560654664
          },
          "p3": {
            "x": 462.09321605215825,
            "y": 699.3171088129496
          },
          "segment": "body"
        },
        {
          "p0": {
            "x": 462.09321605215825,
            "y": 699.3171088129496
          },
          "p1": {
            "x": 523.5298115848764,
            "y": 574.8100871756454
          },
          "p2": {
            "x": 539.9292811451343,
            "y": 433.08307553831094
          },
          "p3": {
            "x": 601.3658766778524,
            "y": 308.5760539010067
          },
          "segment": "body"
        }
      ]
    },
    {
      "kind": "stroke",
      "phase": "main",
      "segment": "body",
      "curves": [
        {
          "p0": {
            "x": 601.3658766778524,
            "y": 308.5760539010067
          },
          "p1": {
            "x": 630.1905279991612,
            "y": 434.1705117449664
          },
          "p2": {
            "x": 677.2932668441588,
            "y": 572.1418843322992
          },
          "p3": {
            "x": 706.1179181654676,
            "y": 697.736342176259
          },
          "segment": "body"
        },
        {
          "p0": {
            "x": 706.1179181654676,
            "y": 697.736342176259
          },
          "p1": {
            "x": 778.449411978387,
            "y": 574.8305990274894
          },
          "p2": {
            "x": 810.8428261061453,
            "y": 407.1346100552444
          },
          "p3": {
            "x": 883.1743199190647,
            "y": 284.2288669064748
          },
          "segment": "body"
        }
      ]
    }
  ]
}
