{
  "schemaVersion": "2.0",
  "glyph": {
    "char": "y",
    "case": "lower",
    "style": "print",
    "name": "traced lower y"
  },
  "guides": {
    "xHeight": 35.24800755033539,
    "baseline": 536.6374790268455,
    "leftSidebearing": 408.2487915917266,
    "rightSidebearing": 835.4948853417266,
    "descender": 950.4771392617447
  },
  "strokes": [
    {
      "kind": "stroke",
      "phase": "main",
      "segment": "body",
      "curves": [
        {
          "p0": {
            "x": 408.30499662769785,
            "y": 39.14680755395683
          },
          "p1": {
            "x": 410.0368142985611,
            "y": 164.43134554856115
          },
          "p2": {
            "x": 420.62443794964037,
            "y": 530.0345660971223
          },
          "p3": {
            "x": 581.6624044514389,
            "y": 532.6656643435251
          },
          "segment": "body"
        },
        {
          "p0": {
            "x": 581.6624044514389,
            "y": 532.6656643435251
          },
          "p1": {
            "x": 884.7831890737409,
            "y": 536.6246065647482
          },
          "p2": {
            "x": 826.5993944512697,
            "y": 165.1501695069206
          },
          "p3": {
            "x": 832.8637870953237,
            "y": 37.53442558453237
          },
          "segment": "body"
        },
        {
          "p0": {
            "x": 832.8637870953237,
            "y": 37.53442558453237
          },
          "p1": {
            "x": 830.636662544964,
            "y": 495.1804181654676
          },
          "p2": {
            "x": 836.2255508093525,
            "y": 757.8511409622301
          },
          "p3": {
            "x": 707.6108644334532,
            "y": 880.2024786420862
          },
          "segment": "descender"
        },
        {
          "p0": {
            "x": 707.6108644334532,
            "y": 880.2024786420862
          },
          "p1": {
            "x": 678.1313230665468,
            "y": 912.9735274280575
          },
          "p2": {
            "x": 585.4913725269784,
            "y": 964.4468019334532
          },
          "p3": {
            "x": 502.62407261690646,
            "y": 936.1475663219423
          },
          "segment": "descender"
        }
      ]
    }
  ]
}
