{
  "schemaVersion": "2.0",
  "glyph": {
    "char": "T",
    "case": "upper",
    "style": "print",
    "name": "template upper T"
  },
  "guides": {
    "xHeight": 414.62615352348985,
    "baseline": 913.0531669463087,
    "leftSidebearing": 150.13367071600467,
    "rightSidebearing": 827.4960660082229,
    "ascender": 40.792785234899156
  },
  "strokes": [
    {
      "kind": "stroke",
      "phase": "main",
      "segment": "body",
      "curves": [
        {
          "p0": {
            "x": 489.43263085864527,
            "y": 41.6966138214566
          },
          "p1": {
            "x": 489.7686679191086,
            "y": 330.8358631183201
          },
          "p2": {
            "x": 490.1047049795719,
            "y": 619.9751124151836
          },
          "p3": {
            "x": 490.4407420400353,
            "y": 909.1143617120471
          },
          "segment": "body"
        }
      ]
    },
    {
      "kind": "stroke",
      "phase": "main",
      "segment": "body",
      "curves": [
        {
          "p0": {
            "x": 149.58044365228918,
            "y": 39.79826038842666
          },
          "p1": {
            "x": 375.13479876206725,
            "y": 40.187664814477195
          },
          "p2": {
            "x": 600.6891538718453,
            "y": 40.57706924052772
          },
          "p3": {
            "x": 826.2435089816234,
            "y": 40.96647366657825
          },
          "segment": "body"
        }
      ]
    }
  ]
}
