{
  "schemaVersion": "2.0",
  "glyph": {
    "char": "Z",
    "case": "upper",
    "style": "print",
    "name": "template upper Z"
  },
  "guides": {
    "xHeight": 414.62615352348985,
    "baseline": 913.0531669463087,
    "leftSidebearing": 435.368499512321,
    "rightSidebearing": 939.8402440795861,
    "ascender": 40.792785234899156
  },
  "strokes": [
    {
      "kind": "stroke",
      "phase": "main",
      "segment": "body",
      "curves": [
        {
          "p0": {
            "x": 435.9863386125889,
            "y": 40.70248894862231
          },
          "p1": {
            "x": 603.5553689983104,
            "y": 40.46191530008549
          },
          "p2": {
            "x": 771.124399384032,
            "y": 40.221341651548656
          },
          "p3": {
            "x": 938.6934297697536,
            "y": 39.98076800301183
          },
          "segment": "body"
        },
        {
          "p0": {
            "x": 938.6934297697536,
            "y": 39.98076800301183
          },
          "p1": {
            "x": 766.8455945175718,
            "y": 328.87009202150017
          },
          "p2": {
            "x": 604.4614989651594,
            "y": 620.8176183901711
          },
          "p3": {
            "x": 432.6136637129777,
            "y": 909.7069424086595
          },
          "segment": "body"
        },
        {
          "p0": {
            "x": 432.6136637129777,
            "y": 909.7069424086595
          },
          "p1": {
            "x": 600.1536793644797,
            "y": 909.6189657854305
          },
          "p2": {
            "x": 767.3651538855939,
            "y": 911.2551993416453
          },
          "p3": {
            "x": 934.905169537096,
            "y": 911.1672227184163
          },
          "segment": "body"
        }
      ]
    }
  ]
}
