{
  "schemaVersion": "2.0",
  "glyph": {
    "char": "l",
    "case": "lower",
    "style": "cursive",
    "name": "traced lower l"
  },
  "guides": {
    "xHeight": 351.641149328859,
    "baseline": 924.3524538590602,
    "leftSidebearing": 524.3553048050047,
    "rightSidebearing": 687.6173706521764,
    "ascender": 45.734584731543464
  },
  "strokes": [
    {
      "kind": "stroke",
      "phase": "main",
      "segment": "entry",
      "curves": [
        {
          "p0": {
            "x": 559.4157486510791,
            "y": 192.44955598021582
          },
          "p1": {
            "x": 562.8196661420864,
            "y": 145.47268435251797
          },
          "p2": {
            "x": 565.7353023830935,
            "y": 103.49806092625899
          },
          "p3": {
            "x": 569.1076045413669,
            "y": 49.161842401079134
          },
          "segment": "entry"
        },
        {
          "p0": {
            "x": 569.1076045413669,
            "y": 49.161842401079134
          },
          "p1": {
            "x": 549.2008154945047,
            "y": 277.8409177241394
          },
          "p2": {
            "x": 545.969182076616,
            "y": 510.3824076827152
          },
          "p3": {
            "x": 529.5072964500177,
            "y": 739.3352544926706
          },
          "segment": "body"
        },
        {
          "p0": {
            "x": 529.5072964500177,
            "y": 739.3352544926706
          },
          "p1": {
            "x": 519.3556697216981,
            "y": 880.5246596386658
          },
          "p2": {
            "x": 596.0404592883315,
            "y": 915.8317462582418
          },
          "p3": {
            "x": 659.2956103866907,
            "y": 917.7825708183453
          },
          "segment": "body"
        },
        {
          "p0": {
            "x": 659.2956103866907,
            "y": 917.7825708183453
          },
          "p1": {
            "x": 677.1368068503305,
            "y": 918.3328033865797
          },
          "p2": {
            "x": 685.8489770683453,
            "y": 919.5319525629495
          },
          "p3": {
            "x": 698.8428788219425,
            "y": 918.6045694694244
          },
          "segment": "exit"
        },
        {
          "p0": {
            "x": 698.8428788219425,
            "y": 918.6045694694244
          },
          "p1": {
            "x": 751.2821773830935,
            "y": 915.7416254496402
          },
          "p2": {
            "x": 811.9963943903601,
            "y": 865.4050647904495
          },
          "p3": {
            "x": 835.7091670413669,
            "y": 850.1995278776978
          },
          "segment": "lead-out"
        }
      ]
    }
  ]
}