{
  "schemaVersion": "2.0",
  "glyph": {
    "char": "m",
    "case": "lower",
    "style": "cursive",
    "name": "traced lower m"
  },
  "guides": {
    "xHeight": 313.2733850671141,
    "baseline": 706.1005662751677,
    "leftSidebearing": 240.4213902782385,
    "rightSidebearing": 763.3629802611573
  },
  "strokes": [
    {
      "kind": "stroke",
      "phase": "main",
      "segment": "entry",
      "curves": [
        {
          "p0": {
            "x": 208.9773493705036,
            "y": 331.2514051258993
          },
          "p1": {
            "x": 224.39158048561148,
            "y": 331.507840602518
          },
          "p2": {
            "x": 245.76354541366905,
            "y": 336.2185251798561
          },
          "p3": {
            "x": 260.67895683453236,
            "y": 316.2481733363309
          },
          "segment": "entry"
        },
        {
          "p0": {
            "x": 260.67895683453236,
            "y": 316.2481733363309
          },
          "p1": {
            "x": 249.23420638489208,
            "y": 543.2743648830935
          },
          "p2": {
            "x": 254.1561847670439,
            "y": 420.2588331506183
          },
          "p3": {
            "x": 247.0768666107383,
            "y": 696.1514261744967
          },
          "segment": "descender"
        }
      ]
    },
    {
      "kind": "stroke",
      "phase": "main",
      "segment": "ascender",
      "curves": [
        {
          "p0": {
            "x": 247.0768666107383,
            "y": 696.1514261744967
          },
          "p1": {
            "x": 261.39038177768583,
            "y": 528.0083477716332
          },
          "p2": {
            "x": 226.82947392086328,
            "y": 391.5523830935252
          },
          "p3": {
            "x": 316.9226337679856,
            "y": 340.8484150179856
          },
          "segment": "ascender"
        },
        {
          "p0": {
            "x": 316.9226337679856,
            "y": 340.8484150179856
          },
          "p1": {
            "x": 407.0157936151079,
            "y": 290.144446942446
          },
          "p2": {
            "x": 509.330035971223,
            "y": 309.41926146582733
          },
          "p3": {
            "x": 507.9042575503354,
            "y": 401.08536073825496
          },
          "segment": "body"
        },
        {
          "p0": {
            "x": 507.9042575503354,
            "y": 401.08536073825496
          },
          "p1": {
            "x": 504.63157158836674,
            "y": 493.5857102908277
          },
          "p2": {
            "x": 500.13222957707654,
            "y": 609.0790119582186
          },
          "p3": {
            "x": 496.8595436151079,
            "y": 701.5793615107914
          },
          "segment": "descender"
        },
        {
          "p0": {
            "x": 496.8595436151079,
            "y": 701.5793615107914
          },
          "p1": {
            "x": 499.16043727517985,
            "y": 570.1860386690647
          },
          "p2": {
            "x": 494.51298336330933,
            "y": 399.6213185701439
          },
          "p3": {
            "x": 546.6396414118705,
            "y": 355.2755451888489
          },
          "segment": "ascender"
        },
        {
          "p0": {
            "x": 546.6396414118705,
            "y": 355.2755451888489
          },
          "p1": {
            "x": 598.7662994604316,
            "y": 310.92977180755395
          },
          "p2": {
            "x": 705.7718165753184,
            "y": 291.7209187096352
          },
          "p3": {
            "x": 738.7133262140287,
            "y": 359.9229991007194
          },
          "segment": "body"
        },
        {
          "p0": {
            "x": 738.7133262140287,
            "y": 359.9229991007194
          },
          "p1": {
            "x": 788.8057413226943,
            "y": 463.6343031573518
          },
          "p2": {
            "x": 730.6479035521583,
            "y": 704.7444075989209
          },
          "p3": {
            "x": 777.8601337679855,
            "y": 704.4985105665468
          },
          "segment": "body"
        },
        {
          "p0": {
            "x": 777.8601337679855,
            "y": 704.4985105665468
          },
          "p1": {
            "x": 784.2850719424459,
            "y": 705.1589197392087
          },
          "p2": {
            "x": 789.743986061151,
            "y": 704.4914849370504
          },
          "p3": {
            "x": 793.1162882194244,
            "y": 704.90248426259
          },
          "segment": "exit"
        },
        {
          "p0": {
            "x": 793.1162882194244,
            "y": 704.90248426259
          },
          "p1": {
            "x": 831.9926090377697,
            "y": 703.6132812500001
          },
          "p2": {
            "x": 892.9496862351949,
            "y": 670.9840999306423
          },
          "p3": {
            "x": 959.8626258389263,
            "y": 630.0990981543623
          },
          "segment": "lead-out"
        }
      ]
    }
  ]
}