{
  "schemaVersion": "2.0",
  "glyph": {
    "char": "n",
    "case": "lower",
    "style": "print",
    "name": "traced lower n"
  },
  "guides": {
    "xHeight": 238.76625419463085,
    "baseline": 758.1926384228186,
    "leftSidebearing": 313.93674123201436,
    "rightSidebearing": 739.9658561979268
  },
  "strokes": [
    {
      "kind": "stroke",
      "phase": "main",
      "segment": "descender",
      "curves": [
        {
          "p0": {
            "x": 326.5266692895683,
            "y": 242.6687556205036
          },
          "p1": {
            "x": 317.35536999461755,
            "y": 555.7689983944083
          },
          "p2": {
            "x": 328.7019739284075,
            "y": 433.61989571513925
          },
          "p3": {
            "x": 318.52799010791364,
            "y": 757.4015006744604
          },
          "segment": "descender"
        },
        {
          "p0": {
            "x": 318.52799010791364,
            "y": 757.4015006744604
          },
          "p1": {
            "x": 319.9692558453237,
            "y": 302.73779379206593
          },
          "p2": {
            "x": 351.24580644188995,
            "y": 248.210204180196
          },
          "p3": {
            "x": 531.9887027877696,
            "y": 246.56788596832496
          },
          "segment": "ascender"
        },
        {
          "p0": {
            "x": 531.9887027877696,
            "y": 246.56788596832496
          },
          "p1": {
            "x": 791.044739208633,
            "y": 250.55844352228178
          },
          "p2": {
            "x": 677.7223375255255,
            "y": 754.986571797364
          },
          "p3": {
            "x": 746.4025554622679,
            "y": 755.5189369814002
          },
          "segment": "body"
        }
      ]
    }
  ]
}
