{
  "schemaVersion": "2.0",
  "glyph": {
    "char": "p",
    "case": "lower",
    "style": "print",
    "name": "traced lower p"
  },
  "guides": {
    "xHeight": 65.6590813758387,
    "baseline": 554.2942533557045,
    "leftSidebearing": 325.42366381927786,
    "rightSidebearing": 755.8027435300579,
    "descender": 972.3023280201339
  },
  "strokes": [
    {
      "kind": "stroke",
      "phase": "main",
      "segment": "descender",
      "curves": [
        {
          "p0": {
            "x": 341.5123370053957,
            "y": 66.12873763489209
          },
          "p1": {
            "x": 320.8745503597122,
            "y": 353.3434970773381
          },
          "p2": {
            "x": 331.30087888247334,
            "y": 669.9528592264215
          },
          "p3": {
            "x": 326.6180024730216,
            "y": 973.9805811600719
          },
          "segment": "descender"
        },
        {
          "p0": {
            "x": 326.6180024730216,
            "y": 973.9805811600719
          },
          "p1": {
            "x": 327.7346445101952,
            "y": 869.5257553174611
          },
          "p2": {
            "x": 305.9837286420863,
            "y": 131.05257981115108
          },
          "p3": {
            "x": 377.7154058003597,
            "y": 96.06143210431654
          },
          "segment": "ascender"
        },
        {
          "p0": {
            "x": 377.7154058003597,
            "y": 96.06143210431654
          },
          "p1": {
            "x": 487.41358475719426,
            "y": 37.43957958633092
          },
          "p2": {
            "x": 685.5503878147481,
            "y": 88.04870166366906
          },
          "p3": {
            "x": 725.2170919514388,
            "y": 151.0791366906475
          },
          "segment": "body"
        },
        {
          "p0": {
            "x": 725.2170919514388,
            "y": 151.0791366906475
          },
          "p1": {
            "x": 764.8837960881294,
            "y": 214.1095717176259
          },
          "p2": {
            "x": 782.1335454098445,
            "y": 457.8151075576709
          },
          "p3": {
            "x": 622.0308153589724,
            "y": 535.2454204013598
          },
          "segment": "body"
        },
        {
          "p0": {
            "x": 622.0308153589724,
            "y": 535.2454204013598
          },
          "p1": {
            "x": 544.9560136486201,
            "y": 572.5210246768245
          },
          "p2": {
            "x": 405.6657408920724,
            "y": 522.4871482958944
          },
          "p3": {
            "x": 332.87081272482015,
            "y": 497.40754271582733
          },
          "segment": "body"
        }
      ]
    }
  ]
}
