{
  "schemaVersion": "2.0",
  "glyph": {
    "char": "t",
    "case": "lower",
    "style": "cursive",
    "name": "traced lower t"
  },
  "guides": {
    "xHeight": 420.9049916107381,
    "baseline": 931.6275167785232,
    "leftSidebearing": 433.7981357287714,
    "rightSidebearing": 682.7963410521583,
    "ascender": 56.45710989932877
  },
  "strokes": [
    {
      "kind": "stroke",
      "phase": "main",
      "segment": "entry",
      "curves": [
        {
          "p0": {
            "x": 564.4285352967626,
            "y": 193.77388714028777
          },
          "p1": {
            "x": 569.5853473471223,
            "y": 145.74668390287772
          },
          "p2": {
            "x": 575.2163893884892,
            "y": 115.91586106115108
          },
          "p3": {
            "x": 581.8346266778526,
            "y": 57.49265939597308
          },
          "segment": "entry"
        }
      ]
    },
    {
      "kind": "stroke",
      "phase": "main",
      "segment": "descender",
      "curves": [
        {
          "p0": {
            "x": 581.8346266778526,
            "y": 57.49265939597308
          },
          "p1": {
            "x": 549.3683194944971,
            "y": 251.97789400315358
          },
          "p2": {
            "x": 482.03546537769796,
            "y": 900.025292266187
          },
          "p3": {
            "x": 597.6808397032374,
            "y": 928.4369379496402
          },
          "segment": "descender"
        },
        {
          "p0": {
            "x": 597.6808397032374,
            "y": 928.4369379496402
          },
          "p1": {
            "x": 619.5375730665468,
            "y": 931.2682666366906
          },
          "p2": {
            "x": 624.8313848920862,
            "y": 931.5387533723022
          },
          "p3": {
            "x": 654.2582340377697,
            "y": 929.7191153327337
          },
          "segment": "exit"
        },
        {
          "p0": {
            "x": 654.2582340377697,
            "y": 929.7191153327337
          },
          "p1": {
            "x": 683.6850831834532,
            "y": 927.8994772931653
          },
          "p2": {
            "x": 797.2156784900028,
            "y": 900.4024811469345
          },
          "p3": {
            "x": 852.644446942446,
            "y": 846.6586106115108
          },
          "segment": "lead-out"
        }
      ]
    },
    {
      "kind": "stroke",
      "phase": "deferred",
      "segment": "body",
      "curves": [
        {
          "p0": {
            "x": 439.505557885906,
            "y": 428.0620805369126
          },
          "p1": {
            "x": 515.8463073291367,
            "y": 424.6501236510791
          },
          "p2": {
            "x": 584.4410409172663,
            "y": 423.6033048561151
          },
          "p3": {
            "x": 681.2682666366907,
            "y": 424.03889388489205
          },
          "segment": "body"
        }
      ]
    }
  ]
}