{
  "schemaVersion": "2.0",
  "glyph": {
    "char": "w",
    "case": "lower",
    "style": "cursive",
    "name": "traced lower w"
  },
  "guides": {
    "xHeight": 281.459731543624,
    "baseline": 704.0687919463087,
    "leftSidebearing": 303.59996057037483,
    "rightSidebearing": 891.9429762354663
  },
  "strokes": [
    {
      "kind": "stroke",
      "phase": "main",
      "segment": "lead-in",
      "curves": [
        {
          "p0": {
            "x": 40.16552383093525,
            "y": 703.1566153327337
          },
          "p1": {
            "x": 109.47335881294964,
            "y": 707.013685926259
          },
          "p2": {
            "x": 138.52082396582733,
            "y": 662.7451944694244
          },
          "p3": {
            "x": 185.00590152877697,
            "y": 615.9123482464029
          },
          "segment": "lead-in"
        },
        {
          "p0": {
            "x": 185.00590152877697,
            "y": 615.9123482464029
          },
          "p1": {
            "x": 231.49097909172662,
            "y": 569.0795020233813
          },
          "p2": {
            "x": 288.82362859712225,
            "y": 353.8458295863309
          },
          "p3": {
            "x": 294.068261016187,
            "y": 333.35206834532374
          },
          "segment": "lead-in"
        },
        {
          "p0": {
            "x": 294.068261016187,
            "y": 333.35206834532374
          },
          "p1": {
            "x": 299.3128934352518,
            "y": 312.85830710431657
          },
          "p2": {
            "x": 300.4967120053957,
            "y": 307.4555980215827
          },
          "p3": {
            "x": 309.97011325503354,
            "y": 282.94096057046977
          },
          "segment": "entry"
        }
      ]
    },
    {
      "kind": "stroke",
      "phase": "main",
      "segment": "body",
      "curves": [
        {
          "p0": {
            "x": 309.97011325503354,
            "y": 282.94096057046977
          },
          "p1": {
            "x": 345.665438863255,
            "y": 415.993013317953
          },
          "p2": {
            "x": 426.3978904439368,
            "y": 566.2650560654664
          },
          "p3": {
            "x": 462.09321605215825,
            "y": 699.3171088129496
          },
          "segment": "body"
        },
        {
          "p0": {
            "x": 462.09321605215825,
            "y": 699.3171088129496
          },
          "p1": {
            "x": 523.5298115848764,
            "y": 574.8100871756454
          },
          "p2": {
            "x": 539.9292811451343,
            "y": 433.08307553831094
          },
          "p3": {
            "x": 601.3658766778524,
            "y": 308.5760539010067
          },
          "segment": "body"
        }
      ]
    },
    {
      "kind": "stroke",
      "phase": "main",
      "segment": "body",
      "curves": [
        {
          "p0": {
            "x": 601.3658766778524,
            "y": 308.5760539010067
          },
          "p1": {
            "x": 630.1905279991612,
            "y": 434.1705117449664
          },
          "p2": {
            "x": 677.2932668441588,
            "y": 572.1418843322992
          },
          "p3": {
            "x": 706.1179181654676,
            "y": 697.736342176259
          },
          "segment": "body"
        },
        {
          "p0": {
            "x": 706.1179181654676,
            "y": 697.736342176259
          },
          "p1": {
            "x": 778.449411978387,
            "y": 574.8305990274894
          },
          "p2": {
            "x": 810.8428261061453,
            "y": 407.1346100552444
          },
          "p3": {
            "x": 883.1743199190647,
            "y": 284.2288669064748
          },
          "segment": "body"
        },
        {
          "p0": {
            "x": 883.1743199190647,
            "y": 284.2288669064748
          },
          "p1": {
            "x": 891.3976315801385,
            "y": 286.43655356754863
          },
          "p2": {
            "x": 903.4417658584961,
            "y": 294.3619518311525
          },
          "p3": {
            "x": 916.097231755619,
            "y": 303.20218395116115
          },
          "segment": "exit"
        },
        {
          "p0": {
            "x": 916.097231755619,
            "y": 303.20218395116115
          },
          "p1": {
            "x": 933.5738275183126,
            "y": 315.4101235454588
          },
          "p2": {
            "x": 981.5691892794489,
            "y": 330.0855636799285
          },
          "p3": {
            "x": 992.9251910971223,
            "y": 333.13427383093523
          },
          "segment": "lead-out"
        }
      ]
    }
  ]
}