{
  "schemaVersion": "2.0",
  "glyph": {
    "char": "A",
    "case": "upper",
    "style": "print",
    "name": "template upper A"
  },
  "guides": {
    "xHeight": 414.62615352348985,
    "baseline": 724.661807885906,
    "leftSidebearing": 310.0204779782059,
    "rightSidebearing": 836.4711179716123,
    "ascender": 40.792785234899156
  },
  "strokes": [
    {
      "kind": "stroke",
      "phase": "main",
      "segment": "body",
      "curves": [
        {
          "p0": {
            "x": 320.1637300312948,
            "y": 720.6561685251675
          },
          "p1": {
            "x": 404.41491671817766,
            "y": 494.84695892596983
          },
          "p2": {
            "x": 488.66610340506054,
            "y": 269.0377493267722
          },
          "p3": {
            "x": 572.9172900919434,
            "y": 43.22853972757463
          },
          "segment": "body"
        },
        {
          "p0": {
            "x": 572.9172900919434,
            "y": 43.22853972757463
          },
          "p1": {
            "x": 655.2731229196921,
            "y": 258.2071558460057
          },
          "p2": {
            "x": 753.9658229538289,
            "y": 507.98446881813965
          },
          "p3": {
            "x": 836.3216557815776,
            "y": 722.9630849365708
          },
          "segment": "body"
        }
      ]
    },
    {
      "kind": "stroke",
      "phase": "main",
      "segment": "body",
      "curves": [
        {
          "p0": {
            "x": 433.2481226826743,
            "y": 414.37564936387446
          },
          "p1": {
            "x": 499.2389287609848,
            "y": 414.2066921055745
          },
          "p2": {
            "x": 641.2929928547187,
            "y": 413.25793211665933
          },
          "p3": {
            "x": 707.2837989330292,
            "y": 413.0889748583594
          },
          "segment": "body"
        }
      ]
    }
  ]
}