{
  "schemaVersion": "2.0",
  "glyph": {
    "char": "u",
    "case": "lower",
    "style": "cursive",
    "name": "traced lower u"
  },
  "guides": {
    "xHeight": 211.65845218120785,
    "baseline": 735.9086619127515,
    "leftSidebearing": 329.33861345819935,
    "rightSidebearing": 746.8549426170385
  },
  "strokes": [
    {
      "kind": "stroke",
      "phase": "main",
      "segment": "entry",
      "curves": [
        {
          "p0": {
            "x": 302.41119604316543,
            "y": 223.53094087230215
          },
          "p1": {
            "x": 323.2843412769784,
            "y": 224.69368255395682
          },
          "p2": {
            "x": 343.4549235611511,
            "y": 234.28366681654674
          },
          "p3": {
            "x": 362.71568682553954,
            "y": 213.79693120503597
          },
          "segment": "entry"
        },
        {
          "p0": {
            "x": 362.71568682553954,
            "y": 213.79693120503597
          },
          "p1": {
            "x": 349.46982248436603,
            "y": 298.66269889131024
          },
          "p2": {
            "x": 323.60049460431657,
            "y": 728.968778102518
          },
          "p3": {
            "x": 494.4567783273381,
            "y": 730.9324415467626
          },
          "segment": "body"
        },
        {
          "p0": {
            "x": 494.4567783273381,
            "y": 730.9324415467626
          },
          "p1": {
            "x": 803.5985274280574,
            "y": 730.2298785971224
          },
          "p2": {
            "x": 731.6307348483782,
            "y": 394.79916820844596
          },
          "p3": {
            "x": 741.2003990557554,
            "y": 214.69972459532374
          },
          "segment": "body"
        },
        {
          "p0": {
            "x": 741.2003990557554,
            "y": 214.69972459532374
          },
          "p1": {
            "x": 740.1887084082733,
            "y": 403.86479878597123
          },
          "p2": {
            "x": 732.6993873651079,
            "y": 462.8379327787769
          },
          "p3": {
            "x": 728.4769840377697,
            "y": 622.0141074640287
          },
          "segment": "descender"
        },
        {
          "p0": {
            "x": 728.4769840377697,
            "y": 622.0141074640287
          },
          "p1": {
            "x": 726.3657823741007,
            "y": 701.6021948066546
          },
          "p2": {
            "x": 746.429223808453,
            "y": 728.5428493142983
          },
          "p3": {
            "x": 769.3705387252696,
            "y": 728.8313392254945
          },
          "segment": "descender"
        },
        {
          "p0": {
            "x": 769.3705387252696,
            "y": 728.8313392254945
          },
          "p1": {
            "x": 792.3118536420862,
            "y": 729.1198291366907
          },
          "p2": {
            "x": 772.8754496402877,
            "y": 729.4254440197841
          },
          "p3": {
            "x": 806.9216501798561,
            "y": 726.580064073741
          },
          "segment": "exit"
        },
        {
          "p0": {
            "x": 806.9216501798561,
            "y": 726.580064073741
          },
          "p1": {
            "x": 840.9678507194245,
            "y": 723.734684127698
          },
          "p2": {
            "x": 917.9119477069354,
            "y": 664.4950713087246
          },
          "p3": {
            "x": 939.3220427852352,
            "y": 649.3288590604025
          },
          "segment": "lead-out"
        }
      ]
    }
  ]
}