{
  "schemaVersion": "2.0",
  "glyph": {
    "char": "J",
    "case": "upper",
    "style": "print",
    "name": "template upper J"
  },
  "guides": {
    "xHeight": 414.62615352348985,
    "baseline": 913.0531669463087,
    "leftSidebearing": 185.40908590477488,
    "rightSidebearing": 834.8257905696055,
    "ascender": 40.792785234899156,
    "descender": 945.8368288590602
  },
  "strokes": [
    {
      "kind": "stroke",
      "phase": "main",
      "segment": "body",
      "curves": [
        {
          "p0": {
            "x": 624.5351855749667,
            "y": 42.68838139339086
          },
          "p1": {
            "x": 624.8698970379111,
            "y": 206.17702576901542
          },
          "p2": {
            "x": 626.9121617856699,
            "y": 403.7156136085264
          },
          "p3": {
            "x": 629.4035441284137,
            "y": 648.4801415403474
          },
          "segment": "body"
        },
        {
          "p0": {
            "x": 629.4035441284137,
            "y": 648.4801415403474
          },
          "p1": {
            "x": 631.8949264711575,
            "y": 893.2446694721684
          },
          "p2": {
            "x": 368.0294244715785,
            "y": 1041.6081718927114
          },
          "p3": {
            "x": 185.62728031698816,
            "y": 699.0622818859254
          },
          "segment": "body"
        }
      ]
    },
    {
      "kind": "stroke",
      "phase": "main",
      "segment": "body",
      "curves": [
        {
          "p0": {
            "x": 430.1530824898251,
            "y": 42.43736896047858
          },
          "p1": {
            "x": 560.7658161721898,
            "y": 42.18280881289646
          },
          "p2": {
            "x": 691.3785498545544,
            "y": 41.928248665314335
          },
          "p3": {
            "x": 821.9912835369191,
            "y": 41.67368851773222
          },
          "segment": "body"
        }
      ]
    }
  ]
}