{
  "schemaVersion": "2.0",
  "glyph": {
    "char": "b",
    "case": "lower",
    "style": "cursive",
    "name": "traced lower b"
  },
  "guides": {
    "xHeight": 414.62615352348985,
    "baseline": 913.0531669463087,
    "leftSidebearing": 311.57779192962585,
    "rightSidebearing": 766.9342503367244,
    "ascender": 40.792785234899156
  },
  "strokes": [
    {
      "kind": "stroke",
      "phase": "main",
      "segment": "entry",
      "curves": [
        {
          "p0": {
            "x": 339.61190422661866,
            "y": 132.3628597122302
          },
          "p1": {
            "x": 341.919823516187,
            "y": 95.68204811151077
          },
          "p2": {
            "x": 344.21369154676256,
            "y": 73.0279058003597
          },
          "p3": {
            "x": 343.7452671196457,
            "y": 43.67207989113029
          },
          "segment": "entry"
        },
        {
          "p0": {
            "x": 343.7452671196457,
            "y": 43.67207989113029
          },
          "p1": {
            "x": 340.9692301503685,
            "y": 203.98310418040964
          },
          "p2": {
            "x": 343.253695718533,
            "y": 334.73495807866476
          },
          "p3": {
            "x": 342.4041790248195,
            "y": 409.41995137264246
          },
          "segment": "descender"
        },
        {
          "p0": {
            "x": 342.4041790248195,
            "y": 409.41995137264246
          },
          "p1": {
            "x": 341.554662331106,
            "y": 484.10494466662016
          },
          "p2": {
            "x": 315.8188469781419,
            "y": 623.6962376713219
          },
          "p3": {
            "x": 312.9742299910072,
            "y": 913.4126292715827
          },
          "segment": "descender"
        },
        {
          "p0": {
            "x": 312.9742299910072,
            "y": 913.4126292715827
          },
          "p1": {
            "x": 317.3400745391266,
            "y": 819.2558684901139
          },
          "p2": {
            "x": 324.0993142985611,
            "y": 700.8767985611511
          },
          "p3": {
            "x": 337.65877922661866,
            "y": 547.6969986510791
          },
          "segment": "ascender"
        },
        {
          "p0": {
            "x": 337.65877922661866,
            "y": 547.6969986510791
          },
          "p1": {
            "x": 370.39821267985604,
            "y": 396.1120166366906
          },
          "p2": {
            "x": 778.1025179856115,
            "y": 323.0068289118705
          },
          "p3": {
            "x": 760.4084700989208,
            "y": 672.275460881295
          },
          "segment": "body"
        },
        {
          "p0": {
            "x": 760.4084700989208,
            "y": 672.275460881295
          },
          "p1": {
            "x": 730.95703125,
            "y": 1022.200989208633
          },
          "p2": {
            "x": 394.1474645589928,
            "y": 883.4934650641667
          },
          "p3": {
            "x": 319.38399851757123,
            "y": 853.6914873108799
          },
          "segment": "body"
        },
        {
          "p0": {
            "x": 319.38399851757123,
            "y": 853.6914873108799
          },
          "p1": {
            "x": 405.69870557851766,
            "y": 880.519430390362
          },
          "p2": {
            "x": 490.758626292022,
            "y": 912.5051246974693
          },
          "p3": {
            "x": 594.7701594143199,
            "y": 911.5918160333026
          },
          "segment": "exit"
        },
        {
          "p0": {
            "x": 594.7701594143199,
            "y": 911.5918160333026
          },
          "p1": {
            "x": 698.7816925366178,
            "y": 910.6785073691359
          },
          "p2": {
            "x": 805.2706272482014,
            "y": 847.6878653327337
          },
          "p3": {
            "x": 925.5318401528776,
            "y": 780.9338466726618
          },
          "segment": "lead-out"
        }
      ]
    }
  ]
}