{
  "schemaVersion": "2.0",
  "glyph": {
    "char": "i",
    "case": "lower",
    "style": "print",
    "name": "traced lower i"
  },
  "guides": {
    "xHeight": 313.5486577181207,
    "baseline": 903.1302432885907,
    "leftSidebearing": 512.3320254855349,
    "rightSidebearing": 743.6784184126143,
    "ascender": 80
  },
  "strokes": [
    {
      "kind": "stroke",
      "phase": "main",
      "segment": "body",
      "curves": [
        {
          "p0": {
            "x": 543.8844762437177,
            "y": 320.00736429079143
          },
          "p1": {
            "x": 533.1397205687188,
            "y": 441.5853574475483
          },
          "p2": {
            "x": 509.9520878644861,
            "y": 786.2075392494205
          },
          "p3": {
            "x": 547.5178450989208,
            "y": 852.121037544964
          },
          "segment": "body"
        },
        {
          "p0": {
            "x": 547.5178450989208,
            "y": 852.121037544964
          },
          "p1": {
            "x": 585.0836023333555,
            "y": 918.0345358405075
          },
          "p2": {
            "x": 696.6510718873207,
            "y": 900.8476503291029
          },
          "p3": {
            "x": 738.8317679136358,
            "y": 870.3928811732759
          },
          "segment": "body"
        }
      ]
    },
    {
      "kind": "mark",
      "phase": "deferred",
      "mark": {
        "x": 555.5812239080431,
        "y": 157.52365295826283,
        "size": 18
      },
      "curves": [
        {
          "p0": {
            "x": 555.5812239080431,
            "y": 157.52365295826283
          },
          "p1": {
            "x": 555.881223908043,
            "y": 157.52365295826283
          },
          "p2": {
            "x": 556.1812239080431,
            "y": 157.52365295826283
          },
          "p3": {
            "x": 556.481223908043,
            "y": 157.52365295826283
          }
        }
      ]
    }
  ]
}
